{
  "$schema": "http://json-schema.org/draft-07/schema#",
  "title": "site-chrome consumer config",
  "description": "consumer固有の正本（site-chrome.config.json）が満たすべきschema。ここからruntime成果物(site-chrome.config.js/theme.css/layout.css)を決定論的に生成する。JSON側を正本にすることで、JSを解析するための新しいAST/parser/regexを作らずにschema検証できる（2026-09-03、GPT相談での設計）。",
  "type": "object",
  "required": ["schemaVersion", "brandName", "brandCopyright", "logoSrc", "homeLabel", "navItems"],
  "properties": {
    "schemaVersion": { "type": "integer", "const": 1 },
    "brandName": { "type": "string", "minLength": 1 },
    "brandCopyright": { "type": "string", "minLength": 1 },
    "logoSrc": { "type": "string", "minLength": 1 },
    "homeLabel": { "type": "string", "minLength": 1 },
    "navCollapseAt": {
      "type": "integer",
      "minimum": 320,
      "maximum": 1920,
      "default": 1100,
      "description": "ハンバーガーメニューへ折りたたむビューポート幅(px)。実測(2026-09-03)でline-botが760pxへ意図的に変更していたことを踏まえ、consumer固有のlayout customizationとして正式にschema化した。"
    },
    "colors": {
      "type": "object",
      "properties": {
        "accent": { "type": "string", "pattern": "^#[0-9a-fA-F]{3,8}$" },
        "accentSoft": { "type": "string", "pattern": "^#[0-9a-fA-F]{3,8}$" },
        "ink": { "type": "string", "pattern": "^#[0-9a-fA-F]{3,8}$" },
        "line": { "type": "string", "pattern": "^#[0-9a-fA-F]{3,8}$" }
      },
      "additionalProperties": false
    },
    "navItems": {
      "type": "array",
      "items": {
        "type": "object",
        "required": ["href", "label"],
        "properties": {
          "href": { "type": "string", "minLength": 1 },
          "label": { "type": "string", "minLength": 1 }
        },
        "additionalProperties": false
      }
    },
    "footerItems": {
      "type": "array",
      "description": "任意。フッターだけに出すリンク（プライバシーポリシー・特定商取引法に基づく表記など）。navItems の後ろに並ぶ。未指定なら何も足さない。2026-10-28、line-bot/apps/lp の実装を正本へ還流。",
      "items": {
        "type": "object",
        "required": ["href", "label"],
        "properties": {
          "href": { "type": "string", "minLength": 1 },
          "label": { "type": "string", "minLength": 1 }
        },
        "additionalProperties": false
      }
    },
    "adminUrl": {
      "type": "string",
      "minLength": 1,
      "description": "任意。運営向け管理画面ログインのURL。指定するとフッター末尾に小さく .site-footer-admin リンクを出す（rel=nofollow noopener）。未指定なら導線そのものを出さない。認証はリンク先の管理画面が担い、LP側は何も持たない。2026-10-05、line-bot/apps/lp の実装を正本へ還流。"
    },
    "adminLabel": {
      "type": "string",
      "minLength": 1,
      "description": "任意。adminUrl のリンク文言。未指定なら Core が「管理者ログイン」を使う。adminUrl が無いときは無視される。"
    }
  },
  "additionalProperties": false
}
