{
  "schemaVersion": 1,
  "brandName": "Kimito-Link",
  "brandCopyright": "Kimito Link — クリエイター支援テンプレート",
  "logoSrc": "/images/logo.png",
  "homeLabel": "🏠 トップ",
  "navCollapseAt": 1100,
  "colors": {
    "accent": "#667eea",
    "accentSoft": "#f0f0ff",
    "ink": "#555",
    "line": "#eee"
  },
  "navItems": [
    { "href": "/guide/", "label": "📋 はじめる準備" },
    { "href": "/showcase/", "label": "📱 公開・導入事例" },
    { "href": "/api-projects/", "label": "🏢 管理体制・API導線" },
    { "href": "/troubleshooting/", "label": "🩹 つまずいたら" },
    { "href": "/features/health-check/", "label": "🎬 起動画面と動作確認" },
    { "href": "/check-shindan-version/", "label": "✅ 更新・動作状況" },
    { "href": "/ai-guide/", "label": "🤖 AI向けガイド" },
    { "href": "/sitemap/", "label": "🗺️ その他の説明" },
    { "href": "/hub/usage/", "label": "📊 AI運用の状況" },
    { "href": "/hub/", "label": "🔒 作業台（本人専用）" }
  ]
}
